{
  "schema_version": "1.0.0",
  "contract_id": "factverify:contract:wd-Q1858-P1376-Q881:v1",
  "fact_id": "factverify:fact:wd-Q1858-P1376-Q881",
  "contract_status": "draft",
  "fact_type": "pretrained_fact",
  "triple": {
    "subject": {
      "id": "wikidata:Q1858",
      "label": "Hà Nội",
      "source": "wikidata",
      "source_url": "https://www.wikidata.org/wiki/Q1858"
    },
    "relation": {
      "id": "wikidata:P1376",
      "label": "capital of",
      "source": "wikidata",
      "source_url": "https://www.wikidata.org/wiki/Property:P1376"
    },
    "object": {
      "id": "wikidata:Q881",
      "label": "Vietnam",
      "source": "wikidata",
      "source_url": "https://www.wikidata.org/wiki/Q881"
    }
  },
  "aliases": {
    "subject": [
      {
        "text": "Hà Nội",
        "language": "vi",
        "alias_type": "canonical",
        "source": "wikidata"
      },
      {
        "text": "Hanoi",
        "language": "en",
        "alias_type": "alternate_name",
        "source": "wikidata"
      },
      {
        "text": "Ha Noi",
        "language": "en",
        "alias_type": "transliteration",
        "source": "manual_adjudication"
      }
    ],
    "relation": [
      {
        "text": "capital of",
        "language": "en",
        "argument_order": "subject_relation_object"
      },
      {
        "text": "has capital",
        "language": "en",
        "argument_order": "object_inverse_relation_subject"
      }
    ],
    "object": [
      {
        "text": "Vietnam",
        "language": "en",
        "alias_type": "canonical",
        "source": "wikidata"
      },
      {
        "text": "Việt Nam",
        "language": "vi",
        "alias_type": "canonical",
        "source": "wikidata"
      },
      {
        "text": "Socialist Republic of Vietnam",
        "language": "en",
        "alias_type": "disambiguated_name",
        "source": "wikidata"
      }
    ]
  },
  "equivalent_directions": [
    {
      "direction": "forward",
      "given": "subject",
      "answer": "object",
      "language": "en",
      "statement_pattern": "{subject} is the capital of ___"
    },
    {
      "direction": "inverse",
      "given": "object",
      "answer": "subject",
      "language": "en",
      "statement_pattern": "The capital of {object} is ___"
    },
    {
      "direction": "verification",
      "given": "triple",
      "answer": "truth_value",
      "language": "en",
      "statement_pattern": "Is it true that {subject} is the capital of {object}?"
    }
  ],
  "retained_neighbourhood": [
    {
      "id": "retain:hanoi-population",
      "bucket": "same_subject",
      "statement": "What is the population of Hà Nội?",
      "language": "en",
      "expected_answers": ["8.4 million", "approximately 8 million"]
    },
    {
      "id": "retain:hanoi-river",
      "bucket": "same_subject",
      "statement": "Which river flows through Hà Nội?",
      "language": "en",
      "expected_answers": ["Red River", "Sông Hồng"]
    },
    {
      "id": "retain:capital-of-laos",
      "bucket": "same_relation",
      "statement": "What is the capital of Laos?",
      "language": "en",
      "expected_answers": ["Vientiane"]
    },
    {
      "id": "retain:capital-of-cambodia",
      "bucket": "same_relation",
      "statement": "What is the capital of Cambodia?",
      "language": "en",
      "expected_answers": ["Phnom Penh"]
    },
    {
      "id": "retain:vietnam-official-language",
      "bucket": "compositional",
      "statement": "What is the official language of the country whose capital is Hà Nội?",
      "language": "en",
      "expected_answers": ["Vietnamese"]
    },
    {
      "id": "retain:vietnam-currency",
      "bucket": "compositional",
      "statement": "What currency is used in the country that Hà Nội is the capital of?",
      "language": "en",
      "expected_answers": ["Vietnamese đồng", "VND"]
    },
    {
      "id": "retain:earth-sun-distance",
      "bucket": "global",
      "statement": "What is the approximate distance from Earth to the Sun?",
      "language": "en",
      "expected_answers": ["150 million km", "93 million miles", "1 AU"]
    },
    {
      "id": "retain:water-boiling-point",
      "bucket": "global",
      "statement": "At what temperature does water boil at sea level?",
      "language": "en",
      "expected_answers": ["100°C", "212°F"]
    }
  ],
  "clue_boundary": {
    "equivalent_rule": "Any prompt whose answer set is exactly {Hà Nội} given the relation 'capital of' and object 'Vietnam', in any language or phrasing declared in aliases.",
    "clue_bearing_rule": "Prompts that mention Vietnam, capital, governance context, or Southeast Asian geography without naming Hà Nội directly.",
    "ambiguous_policy": "adjudicate_before_freeze_else_exploratory"
  },
  "freeze_policy": {
    "freeze_stage": "before_any_unlearning_run",
    "post_freeze_change_policy": "new_contract_version_required",
    "frozen_at": null,
    "content_sha256": null
  }
}
